{"assessment_id":"PIA-FIW-SYN-002","assessment_path":"profiles/perception-integrity/examples/FIW-SYN-002/PIA-FIW-SYN-002.json","assessment_sha256":"d7c041c791575efc46e9cde37d7d07cd628a19308210a227176306aaddaa1684","evaluated_at":"2026-08-08T04:00:00Z","findings":[{"control_id":"PI-04","finding_id":"PI-DERIVATIVE-CORROBORATION","message":"A high-salience or consequential record has fewer than two independent primary roots.","related_field":"source_lineage","severity":"BLOCKING"}],"human_decision_required":true,"profile_version":"0.3.0","recommendation":"REQUIRE_CORROBORATION","ruleset_version":"1.1.0","validation_status":"REVIEW_REQUIRED","validator_version":"0.3.0"}
